{
  "notes": "The query instrument exactly as a scan run used it, archived by gwylio collect so the run can be rebuilt after config/instrument.json moves on. Never edit this file.",
  "version": "2026.10.0",
  "content_hash": "sha256:cf8e838f482996f11a7c9fdc1416fe8e6dd843faa50cd6187b7f5d99cebf0263",
  "global_negative_terms": [
    "epa.gov",
    "clean air act 1970",
    "clean water act",
    "florida",
    "california",
    "new south wales",
    "wales, massachusetts",
    "jimmy wales",
    "princess of wales",
    "prince of wales",
    "sydney",
    "australia"
  ],
  "max_requests_per_run": 150,
  "queries": [
    {
      "id": "web-nature-ecosystems-01",
      "discipline": "osint_web",
      "lane": "welsh-government",
      "text": "\"ecosystem resilience\" Wales policy",
      "requirement_hints": [
        "si1",
        "si2",
        "si3"
      ],
      "topic_hints": [
        "nature-and-ecosystems"
      ],
      "negative_terms": [],
      "site_source_ids": []
    },
    {
      "id": "web-nature-ecosystems-02",
      "discipline": "osint_web",
      "lane": "welsh-government",
      "text": "\"habitat restoration\" Wales programme",
      "requirement_hints": [
        "si1",
        "si2",
        "si3"
      ],
      "topic_hints": [
        "nature-and-ecosystems"
      ],
      "negative_terms": [],
      "site_source_ids": []
    },
    {
      "id": "web-nature-ecosystems-03",
      "discipline": "osint_web",
      "lane": "welsh-government",
      "text": "\"Section 6\" biodiversity duty Wales public bodies",
      "requirement_hints": [
        "si1",
        "si2",
        "si3"
      ],
      "topic_hints": [
        "nature-and-ecosystems"
      ],
      "negative_terms": [],
      "site_source_ids": []
    },
    {
      "id": "web-nature-ecosystems-04",
      "discipline": "osint_web",
      "lane": "welsh-government",
      "text": "\"nature recovery\" Wales legislation OR strategy",
      "requirement_hints": [
        "si1",
        "si2",
        "si3"
      ],
      "topic_hints": [
        "nature-and-ecosystems"
      ],
      "negative_terms": [],
      "site_source_ids": []
    },
    {
      "id": "web-nature-ecosystems-05",
      "discipline": "osint_web",
      "lane": "welsh-government",
      "text": "\"30x30\" Wales protected sites",
      "requirement_hints": [
        "si1",
        "si2",
        "si3"
      ],
      "topic_hints": [
        "nature-and-ecosystems"
      ],
      "negative_terms": [],
      "site_source_ids": []
    },
    {
      "id": "web-nature-ecosystems-06",
      "discipline": "osint_web",
      "lane": "partnership-and-civil-society",
      "text": "\"Sustainable Farming Scheme\" Wales concerns OR criticism",
      "requirement_hints": [
        "si1",
        "si2",
        "si3"
      ],
      "topic_hints": [
        "nature-and-ecosystems"
      ],
      "negative_terms": [],
      "site_source_ids": []
    },
    {
      "id": "web-nature-ecosystems-07",
      "discipline": "osint_web",
      "lane": "partnership-and-civil-society",
      "text": "Wales Environment Link nature recovery",
      "requirement_hints": [
        "si1",
        "si2",
        "si3"
      ],
      "topic_hints": [
        "nature-and-ecosystems"
      ],
      "negative_terms": [],
      "site_source_ids": []
    },
    {
      "id": "web-nature-ecosystems-08",
      "discipline": "osint_web",
      "lane": "senedd",
      "text": "Wales nature petition OR campaign Senedd",
      "requirement_hints": [
        "si1",
        "si2",
        "si3"
      ],
      "topic_hints": [
        "nature-and-ecosystems"
      ],
      "negative_terms": [],
      "site_source_ids": []
    },
    {
      "id": "web-nature-ecosystems-09",
      "discipline": "osint_web",
      "lane": "legal-and-campaign",
      "text": "\"legal challenge\" Wales habitat OR planning OR biodiversity",
      "requirement_hints": [
        "si1",
        "si2",
        "si3"
      ],
      "topic_hints": [
        "nature-and-ecosystems"
      ],
      "negative_terms": [],
      "site_source_ids": []
    },
    {
      "id": "web-pollution-water-land-01",
      "discipline": "osint_web",
      "lane": "welsh-government",
      "text": "\"Water Framework Directive\" Wales classification",
      "requirement_hints": [
        "si4"
      ],
      "topic_hints": [
        "pollution-water-and-land"
      ],
      "negative_terms": [],
      "site_source_ids": []
    },
    {
      "id": "web-pollution-water-land-02",
      "discipline": "osint_web",
      "lane": "welsh-government",
      "text": "river pollution Wales regulation OR enforcement",
      "requirement_hints": [
        "si4"
      ],
      "topic_hints": [
        "pollution-water-and-land"
      ],
      "negative_terms": [],
      "site_source_ids": []
    },
    {
      "id": "web-pollution-water-land-03",
      "discipline": "osint_web",
      "lane": "welsh-government",
      "text": "\"storm overflow\" Wales targets",
      "requirement_hints": [
        "si4"
      ],
      "topic_hints": [
        "pollution-water-and-land"
      ],
      "negative_terms": [],
      "site_source_ids": []
    },
    {
      "id": "web-pollution-water-land-04",
      "discipline": "osint_web",
      "lane": "welsh-government",
      "text": "agricultural pollution Wales rules review",
      "requirement_hints": [
        "si4"
      ],
      "topic_hints": [
        "pollution-water-and-land"
      ],
      "negative_terms": [],
      "site_source_ids": []
    },
    {
      "id": "web-pollution-water-land-05",
      "discipline": "osint_web",
      "lane": "welsh-government",
      "text": "\"contaminated land\" Wales policy",
      "requirement_hints": [
        "si4"
      ],
      "topic_hints": [
        "pollution-water-and-land"
      ],
      "negative_terms": [],
      "site_source_ids": []
    },
    {
      "id": "web-pollution-water-land-06",
      "discipline": "osint_web",
      "lane": "partnership-and-civil-society",
      "text": "\"NFU Cymru\" OR \"Farmers Union of Wales\" pollution regulation",
      "requirement_hints": [
        "si4"
      ],
      "topic_hints": [
        "pollution-water-and-land"
      ],
      "negative_terms": [],
      "site_source_ids": []
    },
    {
      "id": "web-pollution-water-land-07",
      "discipline": "osint_web",
      "lane": "partnership-and-civil-society",
      "text": "farming opposition Wales water rules",
      "requirement_hints": [
        "si4"
      ],
      "topic_hints": [
        "pollution-water-and-land"
      ],
      "negative_terms": [],
      "site_source_ids": []
    },
    {
      "id": "web-pollution-water-land-08",
      "discipline": "osint_web",
      "lane": "welsh-government",
      "text": "\"metal mine\" OR \"abandoned mine\" water pollution Wales rivers",
      "requirement_hints": [
        "si4"
      ],
      "topic_hints": [
        "pollution-water-and-land"
      ],
      "negative_terms": [],
      "site_source_ids": []
    },
    {
      "id": "web-pollution-water-land-09",
      "discipline": "osint_web",
      "lane": "legal-and-campaign",
      "text": "\"judicial review\" \"Natural Resources Wales\"",
      "requirement_hints": [
        "si4"
      ],
      "topic_hints": [
        "pollution-water-and-land"
      ],
      "negative_terms": [],
      "site_source_ids": []
    },
    {
      "id": "web-pollution-water-land-10",
      "discipline": "osint_web",
      "lane": "legal-and-campaign",
      "text": "Wales river pollution \"legal challenge\" OR lawsuit OR claim",
      "requirement_hints": [
        "si4"
      ],
      "topic_hints": [
        "pollution-water-and-land"
      ],
      "negative_terms": [],
      "site_source_ids": []
    },
    {
      "id": "web-pollution-water-land-11",
      "discipline": "osint_web",
      "lane": "senedd",
      "text": "Senedd petition sewage OR \"river pollution\"",
      "requirement_hints": [
        "si4"
      ],
      "topic_hints": [
        "pollution-water-and-land"
      ],
      "negative_terms": [],
      "site_source_ids": []
    },
    {
      "id": "web-air-climate-emissions-01",
      "discipline": "osint_web",
      "lane": "welsh-government",
      "text": "\"Environment (Air Quality and Soundscapes) (Wales) Act\" targets",
      "requirement_hints": [
        "si5",
        "si6"
      ],
      "topic_hints": [
        "climate-emissions",
        "air-quality"
      ],
      "negative_terms": [
        "clean air act 1970",
        "us epa"
      ],
      "site_source_ids": []
    },
    {
      "id": "web-air-climate-emissions-02",
      "discipline": "osint_web",
      "lane": "welsh-government",
      "text": "\"clean air\" Wales regulations consultation",
      "requirement_hints": [
        "si5",
        "si6"
      ],
      "topic_hints": [
        "climate-emissions",
        "air-quality"
      ],
      "negative_terms": [
        "clean air act 1970",
        "us epa"
      ],
      "site_source_ids": []
    },
    {
      "id": "web-air-climate-emissions-03",
      "discipline": "osint_web",
      "lane": "welsh-government",
      "text": "Wales \"carbon budget\" progress",
      "requirement_hints": [
        "si5",
        "si6"
      ],
      "topic_hints": [
        "climate-emissions",
        "air-quality",
        "governance-and-funding"
      ],
      "negative_terms": [
        "clean air act 1970",
        "us epa"
      ],
      "site_source_ids": []
    },
    {
      "id": "web-air-climate-emissions-04",
      "discipline": "osint_web",
      "lane": "welsh-government",
      "text": "\"nitrogen deposition\" Wales protected sites",
      "requirement_hints": [
        "si5",
        "si6"
      ],
      "topic_hints": [
        "climate-emissions",
        "air-quality"
      ],
      "negative_terms": [
        "clean air act 1970",
        "us epa"
      ],
      "site_source_ids": []
    },
    {